Company,Role,Base Salary ($),Equity/RSU ($),Sign-on Bonus ($),Benefits,PTO (days),Status,Deadline,Notes
SafetyCulture,Senior Full Stack Developer,175000,30000,10000,"Health + dental, Super 11.5%, WFH stipend $1.5K/yr, Learning budget $2K",25,Negotiating,2026-03-20,Strong offer but want to negotiate equity component higher; team and culture are excellent
Atlassian,Senior Frontend Engineer,195000,45000,15000,"Health + dental + mental health, Super 12%, $3K learning budget, 5 volunteer days",28,Pending,2026-03-25,Waiting for formal offer letter after final round; verbal confirmation from hiring manager
Canva,Staff Software Engineer,230000,80000,20000,"Comprehensive health, Super 12%, $5K learning budget, 4-day work week trial, parental leave 26 weeks",30,Pending,2026-04-01,Haven't interviewed yet but researching expected package based on level
Google,Cloud Solutions Architect,240000,100000,25000,"Premium health, Super 12%, 20% target bonus, GSPP stock purchase plan, on-site meals",27,Pending,2026-04-10,Aspirational — still in early interview stages; comp based on Levels.fyi data
Rokt,Senior Backend Engineer,200000,60000,12000,"Health + dental, Super 11.5%, gym membership, $2K WFH setup budget",25,Pending,2026-03-28,Technical interviews going well; expecting offer if final round passes
Envato,DevOps Engineer,145000,15000,5000,"Health, Super 11.5%, $1K learning budget, flexible hours",22,Expired,2026-02-15,Received offer but ghosted during process — never responded; let it lapse
Buildkite,Platform Engineer,180000,40000,8000,"Health + dental, Super 11.5%, fully remote, $3K home office budget",25,Declined,2026-02-20,Good offer but declined after Atlassian process looked promising; remote was appealing though
Culture Amp,Data Engineer,170000,25000,7000,"Health, Super 12%, $2.5K learning budget, mental health days",24,Pending,2026-03-30,Onsite round completed; positive signals from interviewers; Melbourne relocation would be needed
