ID,Title,Source,Severity,File/Module,Description,Estimated Effort,Status,Created Date,Resolved Date
TD-001,Auth middleware uses deprecated jsonwebtoken API,AI-Generated,High,src/middleware/auth.ts,"Claude generated auth code using jwt.verify() with callback pattern instead of the promise-based API. Works but triggers deprecation warnings and will break in jsonwebtoken v10. Need to refactor to async/await pattern.",2 hours,Open,2026-02-14,
TD-002,Duplicated validation logic across 4 route handlers,AI-Generated,Medium,src/routes/users.ts; src/routes/orders.ts; src/routes/products.ts; src/routes/invoices.ts,"Each route file has its own copy of input validation logic because they were generated in separate AI sessions. Need to extract into a shared validation middleware with reusable schemas.",4 hours,In Progress,2026-02-22,
TD-003,Test fixtures use hardcoded dates that will fail in 2027,AI-Generated,Low,tests/fixtures/*.ts,"AI generated test data with dates like '2026-12-31' instead of using relative dates. Tests will start failing when these dates become past dates. Should use date-fns addDays(new Date(), 30) pattern.",1 hour,Open,2026-02-25,
TD-004,WebSocket reconnection has no exponential backoff,Manual,High,src/ws/connection.ts,"Original implementation had a fixed 1-second retry interval. AI fix for the race condition (ses_2e6c4a9f) resolved the bug but didn't add backoff. Under heavy load this will hammer the server.",3 hours,Open,2026-02-25,
TD-005,Database migration scripts not idempotent,Refactor-Needed,Medium,migrations/,First 12 migration scripts lack IF NOT EXISTS checks because they were written before we established that convention. Safe for now but will break if migrations are re-run accidentally.,3 hours,Open,2026-01-10,
