Decision ID,Project,Decision,Context/Background,Options Considered,Rationale,Made By,Date,Status,Impact,Notes
DEC-001,Mobile App Redesign,Use OAuth 2.0 with PKCE flow for mobile authentication,"Horizon Financial requires secure authentication for financial data access. Need to balance security with mobile UX.","1. OAuth 2.0 with PKCE | 2. SAML 2.0 federation | 3. Custom JWT implementation",PKCE is the industry standard for mobile apps and avoids exposing client secrets. SAML too heavy for mobile. Custom JWT introduces unnecessary security risk.,Sarah Chen; Tom Bradley,2026-02-05,Approved,High - defines entire authentication architecture,"Documented in ADR-007. Horizon Financial security team reviewed and approved."
DEC-002,Data Platform Migration,Place Customer Portal v2 on hold until DPM Phase 2 completes,"Portal v2 depends on 12 API endpoints being rebuilt as part of the data platform migration. Building against unstable APIs would cause significant rework.","1. Continue portal development against legacy APIs then migrate | 2. Pause portal until new APIs are stable | 3. Build portal with adapter layer for both old and new APIs","Option 2 avoids double-handling and rework. Option 3 adds complexity and estimated 6 weeks extra effort. Steering committee agreed delay is preferable to budget overrun.",Rachel Torres; Sarah Chen,2026-03-14,Approved,High - delays portal launch by approximately 8 weeks,"Product Team initially pushed for Option 3 but agreed after seeing cost-benefit analysis. Portal restart criteria defined: all 12 endpoints passing integration tests."
DEC-003,Q3 Marketing Campaign,Allocate 60% of budget to digital channels and 40% to traditional,"Market research shows target demographic (28-45 financial services professionals) increasingly responsive to digital but still engaged with industry publications.","1. 80% digital / 20% traditional | 2. 60% digital / 40% traditional | 3. 50/50 split","Historical campaign data shows 60/40 split delivers optimal cost-per-acquisition for this demographic. Pure digital misses trade publication audience that drives enterprise leads.",Lisa Nakamura; Emma Walsh,2026-03-17,Approved,Medium - determines channel strategy and agency brief requirements,"CFO approved allocation. David Kim to build tracking model to measure channel effectiveness."
DEC-004,Data Platform Migration,Extend rollback window from 48 to 72 hours post-cutover,"Original 48-hour rollback window deemed insufficient given the volume of data and number of dependent systems. Compliance team requires additional verification time.","1. Keep 48-hour window | 2. Extend to 72 hours | 3. Implement parallel-run for 2 weeks","72 hours provides adequate safety net without the significant cost of parallel-run infrastructure. Compliance team confirmed 72 hours meets their audit requirements.",James Okafor; Derek Russo,2026-03-18,Approved,Medium - requires additional staging environment retention,"Staging environment costs increase by approximately 4K for the extended window. Approved within existing contingency."
DEC-005,Mobile App Redesign,Defer push notification feature from sprint 5 to sprint 7,"Sprint 5 capacity reduced due to team member attending conference. Push notifications have external dependency on notification service vendor contract not yet signed.","1. Include in sprint 5 with overtime | 2. Defer to sprint 6 | 3. Defer to sprint 7","Sprint 7 aligns with vendor contract expected signing date (mid-April). Deferring to sprint 6 would still require building against unsigned contract. No overtime for non-critical features.",Sarah Chen; Priya Sharma,2026-03-24,Approved,Low - feature deferral within acceptable timeline,"Communicated to Horizon Financial. Jonathan Hayes acknowledged deferral with no concerns."
