Risk ID,Project,Description,Category,Probability,Impact,Risk Score,Status,Mitigation Plan,Owner,Date Identified,Review Date,Notes
RSK-001,Mobile App Redesign,Scope creep from client introducing features outside agreed requirements,Scope,High,High,9,Active,"Enforce formal change request process. Weekly scope review with client PM. All requests logged in change register.",Sarah Chen,2026-02-10,2026-04-01,"Three informal feature requests received in March alone. Meeting scheduled with Jonathan Hayes to reset expectations."
RSK-002,Data Platform Migration,Legacy data quality issues causing migration failures or data corruption,Technical,Medium,Critical,10,Active,"Implement pre-migration data cleansing scripts. Run validation checks after each batch. Maintain rollback capability for 72 hours.",Wei Zhang,2025-11-15,2026-03-28,"3.2% of records flagged with malformed dates. Cleansing scripts in development. No impact on go-live if resolved by April 4."
RSK-003,Data Platform Migration,Key team member (Derek Russo) is single point of failure for legacy system knowledge,Resource,Medium,High,8,Active,"Document all legacy system procedures. Schedule knowledge transfer sessions. Create runbook for critical operations.",James Okafor,2025-10-01,2026-04-15,"Two knowledge transfer sessions completed. Runbook 60% complete. Derek has agreed to be available for 4 weeks post-cutover."
RSK-004,Customer Portal v2,Extended project hold causes team skill atrophy and stakeholder disengagement,Schedule,Medium,Medium,6,Monitoring,"Maintain monthly check-in with portal team. Keep documentation current. Schedule restart readiness review 2 weeks before planned resumption.",Sarah Chen,2026-03-16,2026-04-16,"Project on hold since March 16. UX research findings documented. Risk increases if hold extends beyond May."
RSK-005,Q3 Marketing Campaign,Agency selection delays compressing creative development timeline,Schedule,Low,High,6,Active,"Parallel-track agency evaluation. Have backup agency identified. Build 2-week buffer into creative timeline.",Lisa Nakamura,2026-03-17,2026-04-10,"Three agencies shortlisted. Presentations scheduled for April 2-3. Decision expected by April 8."
